Title,Link
LooksRare,https://looksrare.org
LooksRare Documentation,https://docs.looksrare.org
LooksRare Team,https://docs.looksrare.org/team
Review Of LooksRare By Bankless,https://newsletter.banklesshq.com/p/looks-rare
LooksRare VS. Opensea Dashboard,https://dune.xyz/hildobby/LooksRare-VS-OpenSea
Ideal NFT Marketplace Analysis,https://metaversal.banklesshq.com/p/what-is-the-ideal-nft-marketplace
Early News On The Success Of LooksRare,https://decrypt.co/90197/opensea-challenger-looksrare-110m-ethereum-nft-trading-day-one
Tweet About Investors In LooksRare,https://mobile.twitter.com/cryptodickbutt/status/1477674174655172608
PeckShield Audit Report Of LooksRare,https://github.com/peckshield/publications/blob/master/audit_reports/PeckShield-Audit-Report-LooksRare-v1.0.pdf